{
  "id": "ingestion:0001",
  "tenant_id": "tenant-example",
  "brain_id": "customer-operations",
  "source_id": "conformance-fixture",
  "captured_at": "2026-08-09T12:00:00Z",
  "classification": "internal",
  "content_hash": "sha256:aaaaaaaaaaaaaaaaaaaaaaaaaaaaaaaaaaaaaaaaaaaaaaaaaaaaaaaaaaaaaaaa",
  "media_type": "application/json",
  "content_reference": "urn:cortex:content:customer-42",
  "idempotency_key": "ingestion-0001-customer-42",
  "provenance": {
    "actor_id": "test:conformance-suite",
    "system": "conformance-suite",
    "correlation_id": "correlation-0001"
  }
}
